{"schema_version":"1.0.0-fixture","fixture":true,"operational":false,"alerts":[{"severity":"BLOCKED","title":"Variable mapping incomplete","detail":"GAP_ACS_GROUP_VARIABLE_MAPPING_INCOMPLETE blocks Cultural publication."},{"severity":"WARN","title":"Failure-code registry not started","detail":"R2A Task 2C remains the next shared design checkpoint."},{"severity":"INFO","title":"Events V2 implementation unauthorized","detail":"E1 audit and E2 contracts must precede implementation."},{"severity":"INFO","title":"Historical map checksums unavailable","detail":"The historical inventory contains 36 paths, but exact historical checksums were lost; no equivalence claim is permitted."}]}