{"schema_version":"1.0.0-fixture","fixture":true,"operational":false,"alerts":[{"severity":"WARN","title":"V1 scope remains incomplete","detail":"Production usability does not equal original-scope completion."},{"severity":"INFO","title":"V1 remains authoritative","detail":"No V2 feed, map or cutover authority exists."}]}